{
  "contract_version": 1,
  "response_package_id": "responses-complete",
  "model_id": "model-minimal",
  "threat_package_id": "threats-two",
  "source_contract_version": 1,
  "responses": [
    {
      "response_id": "R-01",
      "threat_id": "T-01",
      "affected_model_elements": ["DF-01"],
      "erta": "Eliminate",
      "response": "Remove the cross-origin metadata transfer from the feature.",
      "mechanism_or_text": "The data flow DF-01 no longer sends request metadata to the service.",
      "owner": "Specification editor",
      "evidence_status": "inferred",
      "evidence": [{"source_reference": "Proposed change"}],
      "assumptions": [],
      "transfer_receiver": "",
      "acceptance_rationale": "",
      "revisit_trigger": "",
      "remaining_threat": "",
      "next_action": "Confirm the feature can work without this flow.",
      "status": "proposed"
    },
    {
      "response_id": "R-02",
      "threat_id": "T-02",
      "affected_model_elements": ["DF-01"],
      "erta": "Unresolved",
      "response": "No current specification response to cross-interaction correlation was identified.",
      "mechanism_or_text": "",
      "owner": "Working Group",
      "evidence_status": "unavailable",
      "evidence": [],
      "assumptions": [],
      "transfer_receiver": "",
      "acceptance_rationale": "",
      "revisit_trigger": "",
      "remaining_threat": "Repeated request metadata can still be correlated across interactions.",
      "next_action": "Decide whether to scope or minimize stable request metadata and record the decision in the specification.",
      "response_origin": "blocked",
      "status": "blocked"
    }
  ],
  "unresolved_threats": ["T-02"],
  "cross_cutting_assumptions": [],
  "skeptic_result": {"status": "ready-for-skeptic-check"},
  "next_actions": []
}
