{
  "contract_version": 1,
  "response_package_id": "responses-generic",
  "model_id": "model-minimal",
  "threat_package_id": "threats-minimal",
  "source_contract_version": 1,
  "responses": [
    {
      "response_id": "R-01",
      "threat_id": "T-01",
      "affected_model_elements": ["DF-01"],
      "erta": "Reduce",
      "response": "Improve privacy.",
      "mechanism_or_text": "Document the risk.",
      "owner": "Specification editor",
      "evidence_status": "inferred",
      "evidence": [{"source_reference": "Proposed change"}],
      "assumptions": [],
      "transfer_receiver": "",
      "acceptance_rationale": "",
      "revisit_trigger": "",
      "remaining_threat": "The disclosure remains possible.",
      "next_action": "Review the text.",
      "status": "proposed"
    }
  ],
  "unresolved_threats": [],
  "cross_cutting_assumptions": [],
  "skeptic_result": {"status": "blocked"},
  "next_actions": []
}
